<?xml version="1.0" encoding="UTF-8"?>
<!DOCTYPE configuration SYSTEM "../share/configuration.dtd">
<!--

        Copyright 1990-2006 Sun Microsystems, Inc. All Rights Reserved.
        DO NOT ALTER OR REMOVE COPYRIGHT NOTICES OR THIS FILE HEADER

-->
<configuration>
<constants>
<constant_class Package="com.sun.midp.configurator" Name="Constants" Scope="public">
  <constant Type="int"
            Name="MAX_ISOLATES"
            Value="8"
            Comment="MAX_ISOLATES"/>

  <constant Type="int"
            Name="SUITE_MEMORY_RESERVED"
            Value="100"
            Comment="Default MIDletSuite memory reserved."/>
  <constant Type="int"
            Name="SUITE_MEMORY_LIMIT"
            Value="-1"
            Comment="Default MIDletSuite Memory Limit."/>

  <constant Type="int"
            Name="TCP_CLI_GLOBAL_LIMIT"
            Value="16"
            Comment="Global resource limit for TCP client sockets"/>
  <constant Type="int"
            Name="TCP_CLI_AMS_RESERVED"
            Value="2"
            Comment="Per suite resource limit for TCP client sockets"/>
  <constant Type="int"
            Name="TCP_CLI_AMS_LIMIT"
            Value="(TCP_CLI_GLOBAL_LIMIT)"
            Comment="Per suite resource limit for TCP client sockets"/>
  <constant Type="int"
            Name="TCP_CLI_SUITE_RESERVED"
            Value="0"
            Comment="Per suite resource limit for TCP client sockets"/>
  <constant Type="int"
            Name="TCP_CLI_SUITE_LIMIT"
            Value="(TCP_CLI_GLOBAL_LIMIT - TCP_CLI_AMS_RESERVED)"
            Comment="Per suite resource limit for TCP client sockets"/>

  <constant Type="int"
            Name="TCP_SER_GLOBAL_LIMIT"
            Value="12"
            Comment="Global resource limit for TCP server sockets"/>
  <constant Type="int"
            Name="TCP_SER_AMS_RESERVED"
            Value="0"
            Comment="Per suite resource limit for TCP server sockets"/>
  <constant Type="int"
            Name="TCP_SER_AMS_LIMIT"
            Value="(TCP_SER_GLOBAL_LIMIT)"
            Comment="Per suite resource limit for TCP server sockets"/>
  <constant Type="int"
            Name="TCP_SER_SUITE_RESERVED"
            Value="0"
            Comment="Per suite resource limit for TCP server sockets"/>
  <constant Type="int"
            Name="TCP_SER_SUITE_LIMIT"
            Value="(TCP_SER_GLOBAL_LIMIT - TCP_SER_AMS_RESERVED)"
            Comment="Per suite resource limit for TCP server sockets"/>

  <constant Type="int"
            Name="UDP_GLOBAL_LIMIT"
            Value="12"
            Comment="Global resource limit for UDP sockets"/>
  <constant Type="int"
            Name="UDP_AMS_RESERVED"
            Value="0"
            Comment="Per suite resource limit for UDP sockets"/>
  <constant Type="int"
            Name="UDP_AMS_LIMIT"
            Value="(UDP_GLOBAL_LIMIT)"
            Comment="Per suite resource limit for UDP sockets"/>
  <constant Type="int"
            Name="UDP_SUITE_RESERVED"
            Value="0"
            Comment="Per suite resource limit for UDP sockets"/>
  <constant Type="int"
            Name="UDP_SUITE_LIMIT"
            Value="(UDP_GLOBAL_LIMIT - UDP_AMS_RESERVED)"
            Comment="Per suite resource limit for UDP sockets"/>

  <constant Type="int"
            Name="FILE_GLOBAL_LIMIT"
            Value="30"
            Comment="Global resource limit for File handlers"/>
  <constant Type="int"
            Name="FILE_AMS_RESERVED"
            Value="6"
            Comment="Per suite resource limit for File handlers"/>
  <constant Type="int"
            Name="FILE_AMS_LIMIT"
            Value="(FILE_GLOBAL_LIMIT)"
            Comment="Per suite resource limit for File handlers"/>
  <constant Type="int"
            Name="FILE_SUITE_RESERVED"
            Value="4"
            Comment="Per suite resource limit for File handlers"/>
  <constant Type="int"
            Name="FILE_SUITE_LIMIT"
            Value="(FILE_GLOBAL_LIMIT - FILE_AMS_RESERVED)"
            Comment="Per suite resource limit for File handlers"/>

  <constant Type="int"
            Name="AUDIO_CHA_GLOBAL_LIMIT"
            Value="5"
            Comment="Global resource limit for Audio channels"/>
  <constant Type="int"
            Name="AUDIO_CHA_AMS_RESERVED"
            Value="0"
            Comment="Per suite resource limit for Audio channels"/>
  <constant Type="int"
            Name="AUDIO_CHA_AMS_LIMIT"
            Value="(AUDIO_CHA_GLOBAL_LIMIT)"
            Comment="Per suite resource limit for Audio channels"/>
  <constant Type="int"
            Name="AUDIO_CHA_SUITE_RESERVED"
            Value="0"
            Comment="Per suite resource limit for Audio channels"/>
  <constant Type="int"
            Name="AUDIO_CHA_SUITE_LIMIT"
            Value="(AUDIO_CHA_GLOBAL_LIMIT - AUDIO_CHA_AMS_RESERVED)"
            Comment="Per suite resource limit for Audio channels"/>

  <constant Type="int"
            Name="IMAGE_MUT_GLOBAL_LIMIT"
            Value="1000000"
            Comment="Global resource limit for mutable images"/>
  <constant Type="int"
            Name="IMAGE_MUT_AMS_RESERVED"
            Value="0"
            Comment="Per suite resource limit for mutable images"/>
  <constant Type="int"
            Name="IMAGE_MUT_AMS_LIMIT"
            Value="(IMAGE_MUT_GLOBAL_LIMIT)"
            Comment="Per suite resource limit for mutable images"/>
  <constant Type="int"
            Name="IMAGE_MUT_SUITE_RESERVED"
            Value="0"
            Comment="Per suite resource limit for mutable images"/>
  <constant Type="int"
            Name="IMAGE_MUT_SUITE_LIMIT"
            Value="(IMAGE_MUT_GLOBAL_LIMIT - IMAGE_MUT_AMS_RESERVED)"
            Comment="Per suite resource limit for mutable images"/>

  <constant Type="int"
            Name="IMAGE_IMMUT_GLOBAL_LIMIT"
            Value="1300000"
            Comment="Global resource limit for immutable images"/>
  <constant Type="int"
            Name="IMAGE_IMMUT_AMS_RESERVED"
            Value="0"
            Comment="Per suite resource limit for immutable images"/>
  <constant Type="int"
            Name="IMAGE_IMMUT_AMS_LIMIT"
            Value="(IMAGE_IMMUT_GLOBAL_LIMIT)"
            Comment="Per suite resource limit for immutable images"/>
  <constant Type="int"
            Name="IMAGE_IMMUT_SUITE_RESERVED"
            Value="0"
            Comment="Per suite resource limit for immutable images"/>
  <constant Type="int"
            Name="IMAGE_IMMUT_SUITE_LIMIT"
            Value="(IMAGE_IMMUT_GLOBAL_LIMIT - IMAGE_IMMUT_AMS_RESERVED)"
            Comment="Per suite resource limit for immutable images"/>
 </constant_class>
</constants>
</configuration>
