<?xml version="1.0" encoding="UTF-8"?>
<!DOCTYPE configuration SYSTEM "./configuration.dtd">
<!--

		Copyright 1990-2006 Sun Microsystems, Inc. All Rights Reserved.
		DO NOT ALTER OR REMOVE COPYRIGHT NOTICES OR THIS FILE HEADER
-->
<!-- Properties file common for all platforms -->
<configuration>
<properties>
<!-- INTERNAL PROPERTIES -->
<!-- Visible from Configuration.getProperty() -->
  <!-- System tunable parameters -->

  <property Key="destroyMIDletTimeout"
	  Value="5"
	  Scope="internal"
	  Comment="Destroy MIDlet timeout"/>

  <property Key="system.jam_space"
	  Value="1000000"
	  Scope="internal"
	  Comment="Amount of space to reserve for JAM storage."/>

  <property Key="system.i18n.lang"
	  Value="en"
	  Scope="internal"
	  Comment="Default language for I18N processing."/>      
  <property Key="system.i18n.encoding"
	  Value="ISO8859_1"
	  Scope="internal"
	  Comment="Default encoding for I18N processing."/>
      
  <!-- serial port buffering is on by default to support available() -->
  <!-- property Key="com.sun.midp.io.j2me.comm.buffersize"
				Value="256"
				Scope="internal"/> -->

  <!-- TCP buffering is off by default -->
  <!-- property Key="com.sun.midp.io.j2me.socket.buffersize"
				Value="0"
				Scope="internal"/> -->

  <property Key="com.sun.midp.lcdui.eventHandler"
	  Value="com.sun.midp.lcdui.DefaultEventHandler"
	  Scope="internal"
	  Comment="Default event handler class."/>
  <property Key="com.sun.midp.lcdui.inputHandler"
	  Value="com.sun.midp.lcdui.DefaultInputMethodHandler"
	  Scope="internal"
	  Comment="Default input handler class."/>

  <!-- property Key="com.sun.midp.io.http.proxy" 
				Value="webcache:8080" 
				Scope="internal"/ -->
  <!-- property Key="com.sun.midp.io.http.force_non_persistent" 
				Value="false" 
				Scope="internal"/ -->
  <!-- property Key="com.sun.midp.io.http.persistent_connection_linger_time" 
				Value="60000" 
				Scope="internal"/ -->
  <!-- property Key="com.sun.midp.io.http.input_buffer_size" 
				Value="256" 
				Scope="internal"/ -->
  <!-- property Key="com.sun.midp.io.http.output_buffer_size" 
				Value="2048" 
				Scope="internal"/ -->
  <!-- property Key="com.sun.midp.io.http.max_persistent_connections" 
				Value="4" 
				Scope="internal"/ -->

  <!-- Event queue dispatch table tuning -->
  <!-- property Key="com.sun.midp.events.dispatchTableInitSize" 
				Value="16" 
				Scope="internal"/ -->
      
  <property Key="VmDebuggerPort"
	  Value="2808"
	  Scope="internal"
	  Comment="VM debugger port number."/>
      
      
  <property Key="DisableStartupErrorAlert"
	  Value="0"
	  Scope="internal"
	  Comment="If not 0, don't display start up errors in a
                  Java Alert."/>
      
<!-- SYSTEM PROPERTIES -->
<!-- Visible from System.getProperty() -->

  <property Key="microedition.hostname" 
		Value="" 
		Scope="system"
		Callout="getLocalHostName"
		Comment="The local hostname."/>
  <property Key="microedition.configuration" 
		Value="CLDC-1.1" 
		Scope="system"
		Comment="Configuration information."/>
  <property Key="microedition.profiles" 
		Value="MIDP-2.0" 
		Scope="system"
		Comment="Profile information."/>
  <property Key="microedition.locale" 
		Value="en-US"
		Scope="system"
		Comment="System locale."/>
  <property Key="microedition.platform" 
		Value="j2me" 
		Scope="system"
		Comment="Platform name."/>
  <!-- property Key="microedition.encoding" 
		Value="ISO8859_1" 
		Scope="system"/ -->
  <property Key="microedition.commports" 
		Value="&quot;&quot;" 
		Scope="system"/>
  <property Key="microedition.jtwi.version" 
		Value="1.0" 
		Scope="system"
		Comment="JWTI version number."/>

  <!-- CLDC implementation parameters -->
  <!-- use MIDP protocol implementations -->
  <property Key="javax.microedition.io.Connector.protocolpath" 
		Value="com.sun.midp.io"
		Scope="system"
		Comment=""/>
  <!-- property Key="java.lang.Character.caseConverter" 
		Value="com.sun.cldc.i18n.uclc.DefaultCaseConverter" 
		Scope="system"/ -->
  <!-- property Key="com.sun.cldc.i18n.Helper.i18npath" 
		Value="com.sun.cldc.i18n.j2me" 
		Scope="system"/ -->
  <!-- property Key="microedition.implpath"
		Value="com.sun.cldc" 
		Scope="system"/ -->
  <property Key="com.sun.cldc.util.j2me.TimeZoneImpl.timezone" 
		Value="" 
		Scope="system"
		Callout="getLocalTimeZone"
		Comment="System function of getting local time zone."/>
</properties>
</configuration>
