<?xml version="1.0" encoding="UTF-8"?>
<!DOCTYPE configuration SYSTEM "../share/configuration.dtd">
<!--

        Copyright 1990-2006 Sun Microsystems, Inc. All Rights Reserved.
        DO NOT ALTER OR REMOVE COPYRIGHT NOTICES OR THIS FILE HEADER
-->
<!-- THIS IS THE MMAPI PROPERTIES FILE FOR SHARP ZAURUS 5500D ONLY!
     YOU MAY NEED TO ADJUST THAT TO YOUR PLATFORM -->
<configuration>
<properties>
<!-- SYSTEM PROPERTIES -->
<!-- Visible from System.getProperty() -->
<property Key="microedition.media.version" 
	  Value="1.1" 
	  Scope="system"/>
<property Key="supports.mixing" 
	  Value="true" 
	  Scope="system"/>
<property Key="supports.audio.capture" 
	  Value="true" 
	  Scope="system"/>
<property Key="supports.video.capture" 
	  Value="true"
	  Scope="system"/>
<property Key="supports.recording" 
	  Value="true" 
	  Scope="system"/>
<property Key="audio.encodings" 
	  Value="encoding=pcm" 
	  Scope="system"/>
<property Key="video.snapshot.encodings" 
	  Value="encoding=jpeg" 
	  Scope="system"/>
<property Key="streamable.contents" 
	  Value="audio/x-wav" 
	  Scope="system"/>
<property Key="video.encodings" 
	  Value="encoding=rgb565 encoding=rgb565&amp;width=160&amp;height=120 encoding=rgb565&amp;width=120&amp;height=160 encoding=rgb565&amp;width=240&amp;height=320 encoding=rgb565&amp;width=480&amp;height=640 encoding=rgb565&amp;width=320&amp;height=240 encoding=rgb565&amp;width=480&amp;height=320"
	  Scope="system"/>
</properties>
</configuration>
